{
  "schema": "https://zmig.dev/schema/report/1",
  "schema_version": "1.3",
  "zmig_version": "0.1.0",
  "command": "scan",
  "inputs": {
    "from": {
      "spec": "7823374e872145b5bd018bfe447839eb36042611",
      "sha": "7823374e872145b5bd018bfe447839eb36042611",
      "kind": "sha",
      "url": "https://github.com/zephyrproject-rtos/zephyr",
      "dirty": false
    },
    "to": {
      "spec": "30de5e8a2ceef99177c6c96785a8888b978154f0",
      "sha": "30de5e8a2ceef99177c6c96785a8888b978154f0",
      "kind": "sha",
      "url": "https://github.com/zephyrproject-rtos/zephyr",
      "dirty": false
    },
    "app": "/home/user/.cache/zmig/dogfood/d4/x/v1.1.0/cannectivity/app",
    "app_tree_hash": "ee7d2b9afe1f889cfd29ad4c3552cbc368f74e0a0cc22e522c574a4f1ddc578c",
    "board": {
      "from": "usb2canfdv1",
      "to": "usb2canfdv1",
      "mapping": "same"
    },
    "build_mode": "full",
    "sysbuild": false
  },
  "environment": {
    "python": "3.14.4",
    "west": "West version: v1.5.0",
    "cmake": "cmake version 4.2.3",
    "ninja": "1.13.2",
    "dtc": "Version: DTC 1.7.2",
    "git": "git version 2.53.0",
    "sdk": {
      "path": "/home/user/.cache/zmig/sdks/zephyr-sdk-0.16.8",
      "version": "0.16.8"
    },
    "libclang": "clang version 18.1.1"
  },
  "contexts": [
    {
      "ref": "7823374e872145b5bd018bfe447839eb36042611",
      "board": "usb2canfdv1",
      "mode": "full",
      "sysbuild": false,
      "status": "ok",
      "key": "080088b71f781ced",
      "images": [
        {
          "name": "app",
          "role": "app",
          "role_source": "the default image (domains.yaml), or the only image",
          "status": "ok",
          "board": "usb2canfdv1/stm32g0b1xx"
        }
      ],
      "sdk": {
        "path": "/home/user/.cache/zmig/sdks/zephyr-sdk-0.16.8",
        "version": "0.16.8"
      }
    },
    {
      "ref": "30de5e8a2ceef99177c6c96785a8888b978154f0",
      "board": "usb2canfdv1",
      "mode": "full",
      "sysbuild": false,
      "status": "build-failed",
      "key": "e87ecc62db0a58f9",
      "images": [
        {
          "name": "app",
          "role": "app",
          "role_source": "the default image (domains.yaml), or the only image",
          "status": "build-failed",
          "board": "usb2canfdv1/stm32g0b1xx"
        }
      ],
      "sdk": {
        "path": "/home/user/.cache/zmig/sdks/zephyr-sdk-0.16.8",
        "version": "0.16.8"
      },
      "superseded_by_module_recovery": [
        "cmsis_6"
      ]
    },
    {
      "ref": "30de5e8a2ceef99177c6c96785a8888b978154f0",
      "board": "usb2canfdv1",
      "mode": "full",
      "sysbuild": false,
      "status": "build-failed",
      "key": "6edab0a7d532e37e",
      "images": [
        {
          "name": "app",
          "role": "app",
          "role_source": "the default image (domains.yaml), or the only image",
          "status": "build-failed",
          "board": "usb2canfdv1/stm32g0b1xx"
        }
      ],
      "sdk": {
        "path": "/home/user/.cache/zmig/sdks/zephyr-sdk-0.16.8",
        "version": "0.16.8"
      },
      "modules_added": [
        "cmsis_6"
      ]
    }
  ],
  "analyzers": [
    {
      "name": "api",
      "status": "ok",
      "findings": 2,
      "hazards": 2
    },
    {
      "name": "ble",
      "status": "ok",
      "findings": 0,
      "hazards": 0
    },
    {
      "name": "board",
      "status": "ok",
      "findings": 0,
      "hazards": 0
    },
    {
      "name": "buildlog",
      "status": "ok",
      "findings": 3,
      "hazards": 3
    },
    {
      "name": "crossimage",
      "status": "ok",
      "findings": 0,
      "hazards": 0
    },
    {
      "name": "devicetree",
      "status": "ok",
      "findings": 3,
      "hazards": 1
    },
    {
      "name": "guide",
      "status": "ok",
      "findings": 2,
      "hazards": 1
    },
    {
      "name": "images",
      "status": "ok",
      "findings": 1,
      "hazards": 0
    },
    {
      "name": "initorder",
      "status": "skipped",
      "reason": "target (30de5e8a2ceef99177c6c96785a8888b978154f0): zephyr/zephyr.elf missing: the build failed"
    },
    {
      "name": "kconfig",
      "status": "ok",
      "findings": 3,
      "hazards": 0
    },
    {
      "name": "layout",
      "status": "ok",
      "findings": 0,
      "hazards": 0
    },
    {
      "name": "mcuboot",
      "status": "ok",
      "findings": 0,
      "hazards": 0
    },
    {
      "name": "modules",
      "status": "ok",
      "findings": 3,
      "hazards": 1
    },
    {
      "name": "sbom",
      "status": "skipped",
      "reason": "target (30de5e8a2ceef99177c6c96785a8888b978154f0): the build failed; west spdx needs a full build"
    },
    {
      "name": "storage",
      "status": "ok",
      "findings": 0,
      "hazards": 0
    },
    {
      "name": "sysbuild",
      "status": "ok",
      "findings": 0,
      "hazards": 0
    },
    {
      "name": "wire",
      "status": "ok",
      "findings": 0,
      "hazards": 0
    }
  ],
  "summary": {
    "counts": {
      "breaking": 5,
      "risky": 3,
      "info": 9
    },
    "top": [
      "API-CALLBACK-TYPE-CHANGED-4b10a6e3",
      "API-FUNCTION-REMOVED-32468a0d",
      "BUILD-TARGET-BUILD-FAILED-1f6e0e51",
      "GUIDE-ENTRY-MATCH-0681292e",
      "MANIFEST-MODULE-REQUIRED-f4a43627"
    ]
  },
  "findings": [
    {
      "id": "API-CALLBACK-TYPE-CHANGED-4b10a6e3",
      "category": "api",
      "kind": "callback-type-changed",
      "subject": "const state_execution",
      "title": "Callbacks your code provides no longer match the type Zephyr expects at 30de5e8a2ceef99177c6c96785a8888b978154f0: const state_execution",
      "severity": "breaking",
      "confidence": "high",
      "old": null,
      "new": {
        "expected": "const state_execution",
        "message": "incompatible function pointer types initializing 'const state_execution' (aka 'enum smf_state_result (*const)(void *)') with an expression of type 'void (void *)'"
      },
      "evidence": [
        {
          "type": "file_line",
          "path": "src/led.c",
          "line": 348,
          "text": "const state_execution"
        },
        {
          "type": "file_line",
          "path": "src/led.c",
          "line": 353,
          "text": "const state_execution"
        },
        {
          "type": "file_line",
          "path": "src/led.c",
          "line": 358,
          "text": "const state_execution"
        },
        {
          "type": "file_line",
          "path": "src/led.c",
          "line": 363,
          "text": "const state_execution"
        }
      ],
      "action": "Change their signatures to match (incompatible function pointer types initializing 'const state_execution' (aka 'enum smf_state_result (*const)(void *)') with an expression of type 'void (void *)').",
      "related": [],
      "analyzer": "api",
      "heuristics": [],
      "introduced_by_migration": true
    },
    {
      "id": "API-FUNCTION-REMOVED-32468a0d",
      "category": "api",
      "kind": "function-removed",
      "subject": "smf_set_handled",
      "title": "Function smf_set_handled, which your code uses, no longer exists in 30de5e8a2ceef99177c6c96785a8888b978154f0",
      "severity": "breaking",
      "confidence": "high",
      "old": "void (struct smf_ctx *)",
      "new": null,
      "evidence": [
        {
          "type": "file_line",
          "path": "src/led.c",
          "line": 225,
          "text": "smf_set_handled"
        },
        {
          "type": "file_line",
          "path": "src/led.c",
          "line": 263,
          "text": "smf_set_handled"
        },
        {
          "type": "file_line",
          "path": "src/led.c",
          "line": 271,
          "text": "smf_set_handled"
        },
        {
          "type": "file_line",
          "path": "src/led.c",
          "line": 275,
          "text": "smf_set_handled"
        },
        {
          "type": "tool_output",
          "invocation": "declaration at the source",
          "excerpt": "zephyr/include/zephyr/smf.h:157: void (struct smf_ctx *)"
        }
      ],
      "action": "Find its replacement in the migration guides.",
      "related": [],
      "analyzer": "api",
      "heuristics": [],
      "introduced_by_migration": true
    },
    {
      "id": "BUILD-TARGET-BUILD-FAILED-1f6e0e51",
      "category": "build",
      "kind": "target-build-failed",
      "subject": "30de5e8a2ceef99177c6c96785a8888b978154f0",
      "title": "The target build fails: 2 errors (linker)",
      "severity": "breaking",
      "confidence": "high",
      "old": null,
      "new": {
        "errors": [
          {
            "kind": "linker",
            "image": "",
            "file": "<app>/src/led.c",
            "line": 225,
            "message": "undefined reference to `smf_set_handled'"
          },
          {
            "kind": "linker",
            "image": "",
            "file": "<app>/src/led.c",
            "line": 275,
            "message": "undefined reference to `smf_set_handled'"
          }
        ]
      },
      "evidence": [
        {
          "type": "file_line",
          "path": "src/led.c",
          "line": 225,
          "text": "undefined reference to `smf_set_handled'"
        },
        {
          "type": "file_line",
          "path": "src/led.c",
          "line": 275,
          "text": "undefined reference to `smf_set_handled'"
        }
      ],
      "action": "The Kconfig and devicetree findings often explain these errors; a linker region overflow means the image no longer fits the board's memory.",
      "related": [],
      "analyzer": "buildlog",
      "heuristics": [],
      "introduced_by_migration": true
    },
    {
      "id": "MANIFEST-MODULE-REQUIRED-f4a43627",
      "category": "manifest",
      "kind": "module-required",
      "subject": "cmsis_6",